{
  "$schema": "./schema.json",
  "version": "1.0.0",
  "grid": {
    "columns": { "min": 1, "max": 60 },
    "rows": { "min": "A", "max": "Z" },
    "cellWidthMiles": 12,
    "origin": "west-south"
  },
  "layerTypes": {
    "UG": {
      "name": "Underground",
      "kind": "material",
      "depth": true,
      "description": "Material plane below surface; higher depth number = deeper."
    },
    "EP": {
      "name": "Ether",
      "kind": "plane",
      "coplanar": true,
      "description": "Thin-veil Ether overlay sharing column-row with material surface."
    },
    "BV": {
      "name": "Black Vale",
      "kind": "plane",
      "description": "Sealed rift pocket anchored to Shadowfen cells."
    },
    "DP": {
      "name": "Deep",
      "kind": "material",
      "depth": true,
      "description": "Native underdeep stratum not tied to a surface basement."
    },
    "SK": {
      "name": "Skyreach",
      "kind": "altitude",
      "description": "High-altitude layer above surface column (cliffs, thermals)."
    }
  },
  "biomes": {
    "HL": { "name": "Heartland", "description": "Hills, farmland, roads" },
    "WM": { "name": "Whispering Marches", "description": "Woods, lakes, thin-veil" },
    "SF": { "name": "Shadowfen", "description": "Marsh, ruins, mist" },
    "SK": { "name": "Skyreach", "description": "High cliffs and storms" },
    "FR": { "name": "Frostspire", "description": "Ice, aurora, Winter Court" },
    "UD": { "name": "Underdeep", "description": "Caverns, vaults, crystal" },
    "VV": { "name": "Verdant Vale", "description": "Hidden druid sanctuary" },
    "CO": { "name": "Coast", "description": "Silversea littoral (sparse)" },
    "EW": { "name": "Eastern Wastes", "description": "Unmapped high risk" }
  },
  "regions": {
    "frostspire": { "name": "Frostspire", "defaultBiome": "FR", "bounds": { "colMin": 10, "colMax": 20, "rowMin": "N", "rowMax": "P" } },
    "skyreach": { "name": "Skyreach", "defaultBiome": "SK", "bounds": { "colMin": 15, "colMax": 22, "rowMin": "G", "rowMax": "K" } },
    "whispering_marches": { "name": "Whispering Marches", "defaultBiome": "WM", "bounds": { "colMin": 20, "colMax": 28, "rowMin": "A", "rowMax": "D" } },
    "heartlands": { "name": "Heartlands (Ealdormere)", "defaultBiome": "HL", "bounds": { "colMin": 28, "colMax": 36, "rowMin": "B", "rowMax": "F" } },
    "shadowfen": { "name": "Shadowfen", "defaultBiome": "SF", "bounds": { "colMin": 45, "colMax": 52, "rowMin": "A", "rowMax": "D" } },
    "silversea_coast": { "name": "Silversea Coast", "defaultBiome": "CO", "bounds": { "colMin": 1, "colMax": 9, "rowMin": "A", "rowMax": "Z" } },
    "eastern_wastes": { "name": "Eastern Wastes", "defaultBiome": "EW", "bounds": { "colMin": 51, "colMax": 60, "rowMin": "A", "rowMax": "Z" } }
  },
  "addresses": {
    "14-P": {
      "id": "14-P",
      "column": 14,
      "row": "P",
      "surfaceRoot": "14-P",
      "parent": null,
      "layerStack": [],
      "biomes": ["FR"],
      "region": "frostspire",
      "displayName": "Frostfall Citadel",
      "summary": "Winter Court fortress; aurora rituals.",
      "dangerRating": "elite",
      "registry": { "public": true, "stamped": true },
      "links": { "location": "systems/locations/frostfall-citadel.md" },
      "tags": ["landmark", "court"],
      "childAddresses": []
    },
    "18-H": {
      "id": "18-H",
      "column": 18,
      "row": "H",
      "surfaceRoot": "18-H",
      "parent": null,
      "layerStack": [],
      "biomes": ["SK"],
      "region": "skyreach",
      "displayName": "Skyreach Cliffs (base)",
      "summary": "Monastery footing; lightning glass trade.",
      "dangerRating": "skirmisher",
      "registry": { "public": true, "stamped": true },
      "links": { "location": "systems/locations/skyreach-cliffs.md", "monsters": ["systems/monsters/sky-serpents.md", "systems/monsters/dusk-bat-swarm.md"] },
      "tags": ["landmark"],
      "childAddresses": ["18-H-SK"]
    },
    "18-H-SK": {
      "id": "18-H-SK",
      "column": 18,
      "row": "H",
      "surfaceRoot": "18-H",
      "parent": "18-H",
      "layerStack": [{ "type": "SK" }],
      "biomes": ["SK"],
      "region": "skyreach",
      "displayName": "Skyreach thermals",
      "summary": "Serpent layer; storm calling.",
      "dangerRating": "elite",
      "registry": { "public": true, "stamped": true },
      "links": { "monsters": ["systems/monsters/sky-serpents.md"] },
      "tags": ["plane-altitude"],
      "childAddresses": []
    },
    "23-A": {
      "id": "23-A",
      "column": 23,
      "row": "A",
      "surfaceRoot": "23-A",
      "parent": null,
      "layerStack": [],
      "biomes": ["WM"],
      "region": "whispering_marches",
      "displayName": "Boydon Tower",
      "summary": "Arcane tower on Silverlake; veil stabilizers.",
      "dangerRating": null,
      "registry": { "public": true, "stamped": false },
      "links": { "location": "systems/locations/boydon-tower.md" },
      "tags": ["landmark", "arcane"],
      "childAddresses": ["23-A-UG-1", "23-A-UG-2", "23-A-UG-3", "23-A-EP"]
    },
    "23-A-UG-1": {
      "id": "23-A-UG-1",
      "column": 23,
      "row": "A",
      "surfaceRoot": "23-A",
      "parent": "23-A",
      "layerStack": [{ "type": "UG", "depth": 1 }],
      "biomes": ["WM", "UD"],
      "region": "whispering_marches",
      "displayName": "Boydon undercroft",
      "summary": "Cisterns, undercroft, licensed delve tier 1.",
      "dangerRating": "skirmisher",
      "registry": { "public": true, "stamped": true, "ledgerExample": "REG-1188 rev.A" },
      "links": { "location": "systems/locations/boydon-tower.md" },
      "tags": ["delve"],
      "childAddresses": []
    },
    "23-A-UG-2": {
      "id": "23-A-UG-2",
      "column": 23,
      "row": "A",
      "surfaceRoot": "23-A",
      "parent": "23-A",
      "layerStack": [{ "type": "UG", "depth": 2 }],
      "biomes": ["WM", "UD"],
      "region": "whispering_marches",
      "displayName": "Boydon sealed labs",
      "summary": "Vaulted archives; tower-restricted.",
      "dangerRating": "elite",
      "registry": { "public": true, "stamped": true },
      "links": { "location": "systems/locations/boydon-tower.md" },
      "tags": ["delve", "restricted"],
      "childAddresses": []
    },
    "23-A-UG-3": {
      "id": "23-A-UG-3",
      "column": 23,
      "row": "A",
      "surfaceRoot": "23-A",
      "parent": "23-A",
      "layerStack": [{ "type": "UG", "depth": 3 }],
      "biomes": ["WM", "UD"],
      "region": "whispering_marches",
      "displayName": "Boydon deep vault",
      "summary": "Deepest licensed delve under tower.",
      "dangerRating": "elite",
      "registry": { "public": true, "stamped": true },
      "tags": ["delve", "restricted"],
      "childAddresses": []
    },
    "23-A-EP": {
      "id": "23-A-EP",
      "column": 23,
      "row": "A",
      "surfaceRoot": "23-A",
      "parent": "23-A",
      "layerStack": [{ "type": "EP" }],
      "biomes": ["WM"],
      "region": "whispering_marches",
      "displayName": "Boydon Ether bleed",
      "summary": "Thin-veil overlay in deep labs.",
      "dangerRating": "skirmisher",
      "registry": { "public": false, "stamped": false },
      "links": { "monsters": ["systems/monsters/aetherial-beasts.md", "systems/monsters/ether-larva.md"] },
      "tags": ["thin-veil"],
      "childAddresses": []
    },
    "24-A": {
      "id": "24-A",
      "column": 24,
      "row": "A",
      "surfaceRoot": "24-A",
      "parent": null,
      "layerStack": [],
      "biomes": ["WM"],
      "region": "whispering_marches",
      "displayName": "Edgecombe",
      "summary": "Registry satellite; woods gateway.",
      "dangerRating": null,
      "registry": { "public": true, "stamped": false },
      "links": { "location": "systems/locations/edgecombe.md" },
      "tags": ["settlement", "registry"],
      "childAddresses": []
    },
    "24-B": {
      "id": "24-B",
      "column": 24,
      "row": "B",
      "surfaceRoot": "24-B",
      "parent": null,
      "layerStack": [],
      "biomes": ["WM"],
      "region": "whispering_marches",
      "displayName": "Whispering Woods (west)",
      "summary": "Woodland; path to Edgecombe.",
      "dangerRating": "hazard",
      "registry": { "public": true, "stamped": true },
      "links": { "location": "systems/locations/whispering-woods.md", "monsters": ["systems/monsters/thornwolf.md"] },
      "tags": ["wilderness"],
      "childAddresses": ["24-B-EP"]
    },
    "24-B-EP": {
      "id": "24-B-EP",
      "column": 24,
      "row": "B",
      "surfaceRoot": "24-B",
      "parent": "24-B",
      "layerStack": [{ "type": "EP" }],
      "biomes": ["WM"],
      "region": "whispering_marches",
      "displayName": "Whispering veil (west)",
      "summary": "Moderate thin-veil.",
      "dangerRating": "skirmisher",
      "registry": { "public": true, "stamped": true },
      "tags": ["thin-veil"],
      "childAddresses": []
    },
    "25-A": {
      "id": "25-A",
      "column": 25,
      "row": "A",
      "surfaceRoot": "25-A",
      "parent": null,
      "layerStack": [],
      "biomes": ["WM"],
      "region": "whispering_marches",
      "displayName": "Woods fringe (thorn range)",
      "summary": "Thornwolf territory.",
      "dangerRating": "skirmisher",
      "registry": { "public": true, "stamped": true },
      "links": { "monsters": ["systems/monsters/thornwolf.md"] },
      "tags": ["wilderness"],
      "childAddresses": []
    },
    "25-C": {
      "id": "25-C",
      "column": 25,
      "row": "C",
      "surfaceRoot": "25-C",
      "parent": null,
      "layerStack": [],
      "biomes": ["VV"],
      "region": "whispering_marches",
      "displayName": "Verdant Vale",
      "summary": "Hidden druid sanctuary; not on public Registry maps.",
      "dangerRating": null,
      "registry": { "public": false, "stamped": false },
      "links": { "location": "systems/locations/verdant-vale.md" },